{
  "schemaVersion": 1,
  "profileId": "english",
  "packageId": "voice.english.whisper-small-fp16.darwin-arm64",
  "providerId": "autobyteus.voice.mlx-whisper-small",
  "modelId": "whisper-small-mlx-fp16",
  "recipeSha256": "1b23e408aa033bd57e4861f6b148d656375263672a24e6e6dfad7b06e22e647c",
  "provenanceSha256": "23d549d761fa70c321874fcaef5d5df9107dfcc29db9d54f328ac6da122c3d46",
  "descriptorSha256": "80e0ee85d6eefce7aba5be4e6781946744efd5daa2b176bd9e14d7a3d634a61c",
  "archiveSha256": "9e4d1d5981ba9389f63bdf98094078a6152fbac05ff42d52c287138baafa46f8",
  "noticeInventorySha256": "64479e2833d755dfa4ad25d9c614d2bbe6f503647e1a199af8a1e1261606b8eb",
  "policySha256": "3993ac49c02c8685b4a55834fddad8698068b0c2b8296ac5ec3bdbe6b613febe",
  "components": [
    {
      "componentId": "go",
      "versionOrRevision": "Go 1.26.5",
      "licenseIdentity": "BSD-3-Clause",
      "licenseTextSha256": "911f8f5782931320f5b8d1160a76365b83aea6447ee6c04fa6d5591467db9dad",
      "attributionRequired": true,
      "redistribution": "approved",
      "source": "https://go.dev/LICENSE"
    },
    {
      "componentId": "mlx-wheelhouse",
      "versionOrRevision": "darwin-arm64 lock v1",
      "licenseIdentity": "mixed; see exact package metadata index",
      "licenseTextSha256": "f74b10b7f84070747cf605e24a18755a4c298aebcab46c400bc45b0a97e93142",
      "attributionRequired": true,
      "redistribution": "approved",
      "source": "https://pypi.org/"
    },
    {
      "componentId": "python-build-standalone",
      "versionOrRevision": "CPython 3.12.13 release 20260718",
      "licenseIdentity": "MPL-2.0 plus bundled notices",
      "licenseTextSha256": "1f256ecad192880510e84ad60474eab7589218784b9a50bc7ceee34c2b91f1d5",
      "attributionRequired": true,
      "redistribution": "approved",
      "source": "https://github.com/astral-sh/python-build-standalone"
    },
    {
      "componentId": "whisper-small-mlx",
      "versionOrRevision": "45f3915923c7a79a5a5b5a7d909d39aeb0e5630e",
      "licenseIdentity": "MIT",
      "licenseTextSha256": "508a77d2e7b51d98adeed32648ad124b7b30241a8e70b2e72c99f92d8e5874d1",
      "attributionRequired": true,
      "redistribution": "approved",
      "source": "https://huggingface.co/mlx-community/whisper-small-mlx"
    }
  ],
  "decision": "pass"
}
