{
  "schemaVersion": 1,
  "profileId": "chinese",
  "packageId": "voice.chinese.fun-asr-nano-0.6b-gguf-q8.darwin-arm64",
  "providerId": "autobyteus.voice.funasr-nano-q8",
  "modelId": "fun-asr-nano-gguf-q8",
  "recipeSha256": "aa9f9b437f3155f1767431107acf61b11eab843ccf03369b456de8fd04a0ba70",
  "provenanceSha256": "8d3c35448d5256a6e1a1dd7f92e6ba64aed26ae22cf166b3961e7c4179e87b39",
  "descriptorSha256": "fdd5575345cb5f19692d3889b42bc235704e218321dbf908103ce2a736cec480",
  "archiveSha256": "e867796b0b362f27e3800f593ffac1201e710d3f2b87af883cd1437660ad66c0",
  "noticeInventorySha256": "1d794497c64ba28c1158b51d215159651657cf660e2910cfaaa276dfe1ab2a1a",
  "policySha256": "3993ac49c02c8685b4a55834fddad8698068b0c2b8296ac5ec3bdbe6b613febe",
  "components": [
    {
      "componentId": "fun-asr-nano-gguf",
      "versionOrRevision": "46e849502a867080d66d351b8dfb1018b607e509",
      "licenseIdentity": "model-card governed redistribution",
      "licenseTextSha256": "508a77d2e7b51d98adeed32648ad124b7b30241a8e70b2e72c99f92d8e5874d1",
      "attributionRequired": true,
      "redistribution": "approved",
      "source": "https://huggingface.co/FunAudioLLM/Fun-ASR-Nano-GGUF"
    },
    {
      "componentId": "funasr",
      "versionOrRevision": "53a56d80667320b44a7dd779f5bf8c024b6c30a8",
      "licenseIdentity": "Apache-2.0",
      "licenseTextSha256": "c71d239df91726fc519c6eb72d318ec65820627232b2f796219e87dcf35d0ab4",
      "attributionRequired": true,
      "redistribution": "approved",
      "source": "https://github.com/FunAudioLLM/Fun-ASR"
    },
    {
      "componentId": "go",
      "versionOrRevision": "Go 1.26.5",
      "licenseIdentity": "BSD-3-Clause",
      "licenseTextSha256": "911f8f5782931320f5b8d1160a76365b83aea6447ee6c04fa6d5591467db9dad",
      "attributionRequired": true,
      "redistribution": "approved",
      "source": "https://go.dev/LICENSE"
    },
    {
      "componentId": "llama.cpp",
      "versionOrRevision": "8086439a4cea94c71a5dfb8fe4ad1546aebd640f",
      "licenseIdentity": "MIT",
      "licenseTextSha256": "508a77d2e7b51d98adeed32648ad124b7b30241a8e70b2e72c99f92d8e5874d1",
      "attributionRequired": true,
      "redistribution": "approved",
      "source": "https://github.com/ggml-org/llama.cpp"
    },
    {
      "componentId": "opencc-data",
      "versionOrRevision": "twp-to-cn-v1",
      "licenseIdentity": "Apache-2.0",
      "licenseTextSha256": "b534e465949558eec2597b04f5092b5e161236a68dfbfd04d547592ac3964308",
      "attributionRequired": true,
      "redistribution": "approved",
      "source": "https://github.com/BYVoid/OpenCC"
    },
    {
      "componentId": "utf8proc",
      "versionOrRevision": "a1b99daa2a3393884220264c927a48ba1251a9c6",
      "licenseIdentity": "MIT",
      "licenseTextSha256": "3b510150d34f248a221bb88e1d811238d6c6c18b51231822c42974c39bb07256",
      "attributionRequired": true,
      "redistribution": "approved",
      "source": "https://github.com/JuliaStrings/utf8proc"
    }
  ],
  "decision": "pass"
}
